{
  "processor": "65C02",
  "format_version": "1.0",
  "description": "WDC W65C02S (CMOS) — pełna mapa 256 opcodów (NMOS + CMOS + Rockwell R65C02S)",
  "notes": "Zaimportowane z personal-004 PetEmulator.Cpu6502; warstwa R65C02S (RMB/SMB/BBR/BBS, WAI, STP) dodana; poprawki wg W65C02S: RMW abs,X = 6 cykli, BRK 2-bajtowy, BIT # tylko Z.",
  "instructions": [
    {
      "opcode": "00",
      "mnemonic": "BRK",
      "cycles": 7,
      "words": 2,
      "semantics": "przerwanie SW; push PC+2, P; PC = [FFFE]",
      "group": "system",
      "encoding": "Implied",
      "operands": null,
      "variants": null
    },
    {
      "opcode": "01",
      "mnemonic": "ORA",
      "cycles": 6,
      "words": 2,
      "semantics": "A = A | M",
      "group": "logic",
      "encoding": "IndirectX",
      "operands": [
        {
          "name": "(zp,X)",
          "type": "address8"
        }
      ],
      "variants": null
    },
    {
      "opcode": "02",
      "mnemonic": "NOP",
      "cycles": 2,
      "words": 2,
      "semantics": "brak operacji (dummy read)",
      "group": "system",
      "encoding": "Immediate",
      "operands": [
        {
          "name": "d8",
          "type": "immediate8"
        }
      ],
      "variants": null
    },
    {
      "opcode": "03",
      "mnemonic": "NOP",
      "cycles": 1,
      "words": 1,
      "semantics": "brak operacji (dummy read)",
      "group": "system",
      "encoding": "Implied",
      "operands": null,
      "variants": null
    },
    {
      "opcode": "04",
      "mnemonic": "TSB",
      "cycles": 5,
      "words": 2,
      "semantics": "Z = ((A & M) == 0); M = M | A",
      "group": "bits",
      "encoding": "ZeroPage",
      "operands": [
        {
          "name": "zp",
          "type": "address8"
        }
      ],
      "variants": null
    },
    {
      "opcode": "05",
      "mnemonic": "ORA",
      "cycles": 3,
      "words": 2,
      "semantics": "A = A | M",
      "group": "logic",
      "encoding": "ZeroPage",
      "operands": [
        {
          "name": "zp",
          "type": "address8"
        }
      ],
      "variants": null
    },
    {
      "opcode": "06",
      "mnemonic": "ASL",
      "cycles": 5,
      "words": 2,
      "semantics": "M = M << 1 (C = bit7)",
      "group": "shift",
      "encoding": "ZeroPage",
      "operands": [
        {
          "name": "zp",
          "type": "address8"
        }
      ],
      "variants": null
    },
    {
      "opcode": "07",
      "mnemonic": "RMB0",
      "cycles": 5,
      "words": 2,
      "semantics": "M = M & ~(1 << 0)",
      "group": "bits",
      "encoding": "ZeroPage",
      "operands": [
        {
          "name": "zp",
          "type": "address8"
        }
      ],
      "variants": null
    },
    {
      "opcode": "08",
      "mnemonic": "PHP",
      "cycles": 3,
      "words": 1,
      "semantics": "push P",
      "group": "stack",
      "encoding": "Implied",
      "operands": null,
      "variants": null
    },
    {
      "opcode": "09",
      "mnemonic": "ORA",
      "cycles": 2,
      "words": 2,
      "semantics": "A = A | M",
      "group": "logic",
      "encoding": "Immediate",
      "operands": [
        {
          "name": "d8",
          "type": "immediate8"
        }
      ],
      "variants": null
    },
    {
      "opcode": "0A",
      "mnemonic": "ASL",
      "cycles": 2,
      "words": 1,
      "semantics": "M = M << 1 (C = bit7)",
      "group": "shift",
      "encoding": "Accumulator",
      "operands": null,
      "variants": null
    },
    {
      "opcode": "0B",
      "mnemonic": "ANC",
      "cycles": 2,
      "words": 2,
      "semantics": "A = A & M; C = bit7",
      "group": "arithmetic",
      "encoding": "Immediate",
      "operands": [
        {
          "name": "d8",
          "type": "immediate8"
        }
      ],
      "variants": null
    },
    {
      "opcode": "0C",
      "mnemonic": "TSB",
      "cycles": 6,
      "words": 3,
      "semantics": "Z = ((A & M) == 0); M = M | A",
      "group": "bits",
      "encoding": "Absolute",
      "operands": [
        {
          "name": "a16",
          "type": "address16"
        }
      ],
      "variants": null
    },
    {
      "opcode": "0D",
      "mnemonic": "ORA",
      "cycles": 4,
      "words": 3,
      "semantics": "A = A | M",
      "group": "logic",
      "encoding": "Absolute",
      "operands": [
        {
          "name": "a16",
          "type": "address16"
        }
      ],
      "variants": null
    },
    {
      "opcode": "0E",
      "mnemonic": "ASL",
      "cycles": 6,
      "words": 3,
      "semantics": "M = M << 1 (C = bit7)",
      "group": "shift",
      "encoding": "Absolute",
      "operands": [
        {
          "name": "a16",
          "type": "address16"
        }
      ],
      "variants": null
    },
    {
      "opcode": "0F",
      "mnemonic": "BBR0",
      "cycles": 5,
      "words": 3,
      "semantics": "skok gdy bit 0 M == 0",
      "group": "branch",
      "encoding": "ZeroPageRelative",
      "operands": [
        {
          "name": "zp",
          "type": "address8"
        },
        {
          "name": "rel",
          "type": "relative8"
        }
      ],
      "variants": null
    },
    {
      "opcode": "10",
      "mnemonic": "BPL",
      "cycles": 2,
      "words": 2,
      "semantics": "skok gdy N=0",
      "group": "branch",
      "encoding": "Relative",
      "operands": [
        {
          "name": "rel",
          "type": "relative8"
        }
      ],
      "variants": null
    },
    {
      "opcode": "11",
      "mnemonic": "ORA",
      "cycles": 5,
      "words": 2,
      "semantics": "A = A | M",
      "group": "logic",
      "encoding": "IndirectY",
      "operands": [
        {
          "name": "(zp),Y",
          "type": "address8"
        }
      ],
      "variants": null
    },
    {
      "opcode": "12",
      "mnemonic": "ORA",
      "cycles": 5,
      "words": 2,
      "semantics": "A = A | M",
      "group": "logic",
      "encoding": "ZeroPageIndirect",
      "operands": [
        {
          "name": "(zp)",
          "type": "address8"
        }
      ],
      "variants": null
    },
    {
      "opcode": "13",
      "mnemonic": "NOP",
      "cycles": 1,
      "words": 1,
      "semantics": "brak operacji (dummy read)",
      "group": "system",
      "encoding": "Implied",
      "operands": null,
      "variants": null
    },
    {
      "opcode": "14",
      "mnemonic": "TRB",
      "cycles": 5,
      "words": 2,
      "semantics": "Z = ((A & M) == 0); M = M & ~A",
      "group": "bits",
      "encoding": "ZeroPage",
      "operands": [
        {
          "name": "zp",
          "type": "address8"
        }
      ],
      "variants": null
    },
    {
      "opcode": "15",
      "mnemonic": "ORA",
      "cycles": 4,
      "words": 2,
      "semantics": "A = A | M",
      "group": "logic",
      "encoding": "ZeroPageX",
      "operands": [
        {
          "name": "zp",
          "type": "address8"
        },
        {
          "name": "X",
          "type": "index"
        }
      ],
      "variants": null
    },
    {
      "opcode": "16",
      "mnemonic": "ASL",
      "cycles": 6,
      "words": 2,
      "semantics": "M = M << 1 (C = bit7)",
      "group": "shift",
      "encoding": "ZeroPageX",
      "operands": [
        {
          "name": "zp",
          "type": "address8"
        },
        {
          "name": "X",
          "type": "index"
        }
      ],
      "variants": null
    },
    {
      "opcode": "17",
      "mnemonic": "RMB1",
      "cycles": 5,
      "words": 2,
      "semantics": "M = M & ~(1 << 1)",
      "group": "bits",
      "encoding": "ZeroPage",
      "operands": [
        {
          "name": "zp",
          "type": "address8"
        }
      ],
      "variants": null
    },
    {
      "opcode": "18",
      "mnemonic": "CLC",
      "cycles": 2,
      "words": 1,
      "semantics": "C = 0",
      "group": "flags",
      "encoding": "Implied",
      "operands": null,
      "variants": null
    },
    {
      "opcode": "19",
      "mnemonic": "ORA",
      "cycles": 4,
      "words": 3,
      "semantics": "A = A | M",
      "group": "logic",
      "encoding": "AbsoluteY",
      "operands": [
        {
          "name": "a16",
          "type": "address16"
        },
        {
          "name": "Y",
          "type": "index"
        }
      ],
      "variants": null
    },
    {
      "opcode": "1A",
      "mnemonic": "INC",
      "cycles": 2,
      "words": 1,
      "semantics": "M = M + 1",
      "group": "arithmetic",
      "encoding": "Accumulator",
      "operands": null,
      "variants": null
    },
    {
      "opcode": "1B",
      "mnemonic": "NOP",
      "cycles": 1,
      "words": 1,
      "semantics": "brak operacji (dummy read)",
      "group": "system",
      "encoding": "Implied",
      "operands": null,
      "variants": null
    },
    {
      "opcode": "1C",
      "mnemonic": "TRB",
      "cycles": 6,
      "words": 3,
      "semantics": "Z = ((A & M) == 0); M = M & ~A",
      "group": "bits",
      "encoding": "Absolute",
      "operands": [
        {
          "name": "a16",
          "type": "address16"
        }
      ],
      "variants": null
    },
    {
      "opcode": "1D",
      "mnemonic": "ORA",
      "cycles": 4,
      "words": 3,
      "semantics": "A = A | M",
      "group": "logic",
      "encoding": "AbsoluteX",
      "operands": [
        {
          "name": "a16",
          "type": "address16"
        },
        {
          "name": "X",
          "type": "index"
        }
      ],
      "variants": null
    },
    {
      "opcode": "1E",
      "mnemonic": "ASL",
      "cycles": 6,
      "words": 3,
      "semantics": "M = M << 1 (C = bit7)",
      "group": "shift",
      "encoding": "AbsoluteX",
      "operands": [
        {
          "name": "a16",
          "type": "address16"
        },
        {
          "name": "X",